{
  "domain": "general",
  "subdomain": "reasoning",
  "version": "1.0",
  "description": "General reasoning and logic test cases",
  "cases": [
    {
      "id": "reasoning-001",
      "prompt": "If all roses are flowers, and all flowers need water, what can we conclude about roses?",
      "expected_specialist": "reasoning-specialist",
      "expected_response_contains": ["water", "need"],
      "difficulty": "easy",
      "tags": ["syllogism", "deduction"]
    },
    {
      "id": "reasoning-002",
      "prompt": "A train leaves Station A at 9:00 AM traveling at 60 mph. Another train leaves Station B (280 miles away) at 10:00 AM traveling toward Station A at 80 mph. At what time will they meet?",
      "expected_specialist": "reasoning-specialist",
      "expected_response_contains": ["11"],
      "difficulty": "medium",
      "tags": ["math", "word-problem"]
    },
    {
      "id": "reasoning-003",
      "prompt": "In a room of 23 people, what is the approximate probability that at least two people share a birthday? Explain your reasoning.",
      "expected_specialist": "reasoning-specialist",
      "expected_response_contains": ["50", "probability"],
      "difficulty": "hard",
      "tags": ["probability", "birthday-paradox"]
    },
    {
      "id": "reasoning-004",
      "prompt": "If it takes 5 machines 5 minutes to make 5 widgets, how long would it take 100 machines to make 100 widgets?",
      "expected_specialist": "reasoning-specialist",
      "expected_response_contains": ["5", "minute"],
      "difficulty": "medium",
      "tags": ["logic-puzzle"]
    },
    {
      "id": "reasoning-005",
      "prompt": "Calculate the sum of all integers from 1 to 100.",
      "expected_specialist": "reasoning-specialist",
      "expected_response_contains": ["5050"],
      "difficulty": "easy",
      "tags": ["math", "arithmetic"]
    }
  ]
}
